<?xml version="1.0" encoding="UTF-8"?>
<?xml-stylesheet type="text/xsl" href="employee.xsl"?>
<Employee xmlns:xsi="http://www.w3.org/2001/XMLSchema-instance" xsi:noNamespaceSchemaLocation="employeeschema.xsd">
    <emp>
        <emp-id>A1</emp-id>
        <name>Khasi</name>
        <age>56</age>
        <gender>M</gender>
        <address>Banglore</address>
        <emailid>Khasi20@gmail.com</emailid>
        <designation>Doctor</designation>
        <specification>Neuro</specification>
        <yearofexperince>30</yearofexperince>
        <salary>320000</salary>
    </emp>
    <emp>
        <emp-id>A2</emp-id>

        <name>Uma</name>
        <age>40</age>
        <gender>F</gender>
        <address>Banglore</address>
        <emailid>Uma20@gmail.com</emailid>
        <designation>Doctor</designation>
        <specification>Cardiology</specification>
        <yearofexperince>23</yearofexperince>
        <salary>250000</salary>
    </emp>
    <emp>
        <emp-id>A3</emp-id>
        <name>Suresh</name>
        <age>50</age>
        <gender>M</gender>
        <address>Banglore</address>
        <emailid>Suresh20@gmail.com</emailid>
        <designation>Doctor</designation>
        <specification>Ortho</specification>
        <yearofexperince>25</yearofexperince>
        <salary>250000</salary>
    </emp>
    <emp>
        <emp-id>A4</emp-id>

        <name>Geetha</name>
        <age>40</age>
        <gender>F</gender>
        <address>Banglore</address>
        <emailid>Geetha20@gmail.com</emailid>
        <designation>Nurse</designation>
        <specification>NULL</specification>
        <yearofexperince>20</yearofexperince>
        <salary>100000</salary>
    </emp>
    <emp>
        <emp-id>A5</emp-id>

        <name>George</name>
        <age>36</age>
        <gender>M</gender>
        <address>Banglore</address>
        <emailid>George20@gmail.com</emailid>
        <designation>Nurse</designation>
        <specification>NULL</specification>
        <yearofexperince>17</yearofexperince>
        <salary>80000</salary>
    </emp>
    <emp>
        <emp-id>A6</emp-id>

        <name>Kishore</name>
        <age>30</age>
        <gender>M</gender>
        <address>Banglore</address>
        <emailid>Kishore20@gmail.com</emailid>
        <designation>Pharmacist</designation>
        <specification>NULL</specification>
        <yearofexperince>10</yearofexperince>
        <salary>50000</salary>
    </emp>

</Employee>